SASPA17S-02	S. aureus	t003	aST225, ST225, t003		erm_A_.1_X03216, ant_9__Ia.1_X02588, blaZ.29_JDXN01000019, aadD.2_M19465, mecA_15_AB505628, mecA.6_BX571856	blaZ, blaR1, blaR1, blaI, ant(9)-Ia, erm(A), mecI, mecR1, mecA, aadD1, bleO, gyrA_S84L, fosB, parC_S80F, parE_P585S, tet(38)
SASPA17S-03	S. aureus	t108	aST398, ST398, t108		tet_M_.13_AM990992, tet_K_.1_U38656, mecA_10_AB512767, str.2_FN435330, blaZ.95_MAJJ01000071, mecA.8_NC_007168	mecA, tet(K), str, tet(M), glpT_F3I, tet(38), blaZ, blaI, murA_D278E, murA_E291D
SASPA17S-04	S. aureus	t011	aST398, ST398, t011		dfrK.2_FN677369, tet_M_.13_AM990992, str.2_FN435330, mecA_15_AB505628, aac_6___aph_2___.1_M13771, blaZ.95_MAJJ01000071, mecA.6_BX571856	parC_S80F, blaZ, blaI, mecA, tet(M), str, spd, gyrA_S84L, aac(6')-Ie/aph(2'')-Ia, glpT_F3I, dfrK, murA_D278E, murA_E291D, tet(38)
SASPA17S-05	S. aureus	t002	aST5, ST5, t002		erm_A_.1_X03216, ant_9__Ia.1_X02588, blaZ.29_JDXN01000019, aadD.2_M19465, mecA_15_AB505628, mecA.6_BX571856	mecA, mecR1, mecI, gyrA_S84L, fosB, blaZ, blaR1, blaR1, blaI, ant(9)-Ia, erm(A), bleO, aadD1, parC_S80F, tet(38)
SASPA17S-06	S. aureus	t032	aST22, ST22, t032		mecA.2_NC_002951, erm_C_.13_M13761, mecA_4_AB033763, erm_33_.1_AJ579365, blaZ.138_CP003979	gyrA_S84L, mecA, tet(38), blaI, blaZ, erm(C), parE_P585S, parC_S80F
PU117379	S. aureus		aST130, ST130, t528	mecC	blaZ.10_FR823292, mecC_2_FR821779__mecA_6_, mecC.1_FR821779	tet(38), mecI, mecC, blaZ, murA_E291D, murA_T396N
PY1704281	S. aureus	t843	aST130, ST130, t843	mecC (PVL-)	blaZ.10_FR823292, mecC_2_FR821779__mecA_6_, mecC.1_FR821779	blaZ, mecC, mecI, tet(38), murA_E291D, murA_T396N
PY1705269	S. aureus	t16761	aST130, ST130, t16761	mecC (PVL-)	blaZ.10_FR823292, mecC_2_FR821779__mecA_6_, mecC.1_FR821779	tet(38), mecI, mecC, blaZ, murA_E291D, murA_T396N
HY170610	S. aureus	t386	aST1, ST1, t386	mecA (PVL-)	cfr_C_.1_KX686749, erm_C_.13_M13761, tet_K_.1_U38656, aph_3___III.1_M26832, mecA_15_AB505628, ant_6__Ia.1_AF330699, mecA.6_BX571856, erm_33_.1_AJ579365, blaZ.7_AP004832, ant_6__Ia.2_KF421157	blaI, blaR1, blaZ, ant(6)-Ia, sat4, aph(3')-IIIa, erm(C), erm(C), tet(K), mecA, tet(38)
HY170908	S. aureus	t386	aST1, ST1, t386	mecA (PVL-)	cfr_C_.1_KX686749, erm_C_.13_M13761, tet_K_.1_U38656, aph_3___III.1_M26832, mecA_15_AB505628, ant_6__Ia.1_AF330699, mecA.6_BX571856, erm_33_.1_AJ579365, blaZ.7_AP004832, ant_6__Ia.2_KF421157	erm(C), tet(38), mecA, blaZ, blaR1, blaI, aph(3')-IIIa, sat4, ant(6)-Ia, tet(K)
HY170910	S. aureus	t386	aST1, ST1, t386	mecA (PVL-)	cfr_C_.1_KX686749, erm_C_.13_M13761, tet_K_.1_U38656, aph_3___III.1_M26832, mecA_15_AB505628, ant_6__Ia.1_AF330699, mecA.6_BX571856, erm_33_.1_AJ579365, blaZ.7_AP004832, ant_6__Ia.2_KF421157	blaZ, blaR1, blaI, aph(3')-IIIa, sat4, ant(6)-Ia, tet(K), erm(C), mecA, tet(38)
HY171014	S. aureus	t386	aST1, ST1, t386	mecA (PVL-)	cfr_C_.1_KX686749, erm_C_.13_M13761, tet_K_.1_U38656, aph_3___III.1_M26832, mecA_15_AB505628, ant_6__Ia.1_AF330699, mecA.6_BX571856, blaZ.7_AP004832, ant_6__Ia.2_KF421157	tet(K), erm(C), mecA, tet(38), blaZ, blaR1, blaI, aph(3')-IIIa, sat4, ant(6)-Ia
HY171211	S. aureus	t386	aST1, ST1, t386	mecA (PVL-)	cfr_C_.1_KX686749, erm_C_.13_M13761, tet_K_.1_U38656, aph_3___III.1_M26832, mecA_15_AB505628, ant_6__Ia.1_AF330699, mecA.6_BX571856, blaZ.7_AP004832, ant_6__Ia.2_KF421157	aph(3')-IIIa, sat4, ant(6)-Ia, tet(K), erm(C), mecA, tet(38), blaZ, blaR1, blaI
HY171212	S. aureus	t386	aST1, ST1, t386	mecA (PVL-)	cfr_C_.1_KX686749, erm_C_.13_M13761, tet_K_.1_U38656, aph_3___III.1_M26832, mecA_15_AB505628, ant_6__Ia.1_AF330699, mecA.6_BX571856, blaZ.7_AP004832, ant_6__Ia.2_KF421157	blaI, blaR1, blaZ, ant(6)-Ia, sat4, aph(3')-IIIa, tet(K), erm(C), mecA, tet(38)
HY170721	S. aureus	t386	aST1, ST1, t386	mecA (PVL-)	cfr_C_.1_KX686749, erm_C_.13_M13761, tet_K_.1_U38656, aph_3___III.1_M26832, mecA_15_AB505628, ant_6__Ia.1_AF330699, mecA.6_BX571856, erm_33_.1_AJ579365, blaZ.7_AP004832, ant_6__Ia.2_KF421157	blaZ, blaR1, blaI, aph(3')-IIIa, sat4, ant(6)-Ia, tet(K), erm(C), mecA, tet(38)
HY161669	S. aureus	t1339	aST88, ST88, t1339	mecA	blaZ.97_FMOK01000003, tet_K_.1_U38656, mecA.6_BX571856, mecA_15_AB505628	blaZ, blaR1, blaI, tet(K), tet(38), mecA
HY176242	S. aureus	t088	aST5, ST5, t088	mecA (PVL-)	msr_A_.1_X52085, mecA_15_AB505628, tet_K_.1_U38656, mecA.6_BX571856, mph_C_.2_AF167161	mph(C), msr(A), mecA, tet(K), fosB, tet(38)
HY176190	S. aureus	t1339	aST88, ST88, t1339	mecA (PVL-)	blaZ.97_FMOK01000003, mecA_15_AB505628, mecA.6_BX571856	mecA, tet(38), blaZ, blaR1, blaI
HY176435	S. aureus	t1171	aST8*, ST8, t1171	mecA (PVL+)	PVL_FJ895584, blaZ.3_CP000732, mecA_15_AB505628, mecA.6_BX571856	mecA, blaZ, blaR1, blaI, fosB, tet(38), murA_G257D
PY1704946	S. aureus	t437	aSTNovel*, t437	mecA (PVL+)	mecA_10_AB512767, blaZ.13_KF471116, mecA.8_NC_007168, PVL_HM584708	murA_E291D, murA_T396N, tet(38), blaZ, blaR1, blaR1, blaI, mecA
HY176898	S. aureus	t1028	aST80, ST80, t1028	mecA (PVL+)	erm_C_.13_M13761, tet_K_.1_U38656, blaZ.5_AJ302698, PVL_HM584703, mecA.2_NC_002951, fusB.1_AY373761, mecA_4_AB033763, erm_33_.1_AJ579365	mecA, blaI, blaR1, blaZ, tet(K), fusB, erm(C), tet(38)
HY177532	S. aureus	t3527	aST59, ST59, t3527	mecA (PVL+)	cfr_C_.1_KX686749, PVL_JN635508, blaZ.13_KF471116, aph_3___III.1_M26832, mecA_15_AB505628, ant_6__Ia.1_AF330699, erm_B_.10_U86375, mecA.6_BX571856, ant_6__Ia.2_KF421157	murA_E291D, murA_T396N, mecA, tet(38), ant(6)-Ia, aph(3')-IIIa, erm(B), blaI, blaR1, blaR1, blaZ
PY1706490	S. aureus	t127	aST1, ST1, t127	mecA (PVL+)	mecA_10_AB512767, fusC.1_KF527883, aac_6___aph_2___.1_M13771, PVL_FJ895584, mecA.8_NC_007168	fusC, mecA, aac(6')-Ie/aph(2'')-Ia, tet(38)
PY1707502	S. aureus	t044	aST80, ST80, t044	mecA (PVL+)	erm_C_.13_M13761, tet_K_.1_U38656, blaZ.5_AJ302698, PVL_HM584703, mecA.2_NC_002951, fusB.1_AY373761, mecA_4_AB033763, erm_33_.1_AJ579365	blaZ, blaR1, blaI, mecA, tet(K), fusB, erm(C), tet(38)
PY1707767	S. aureus	t019	aST30, ST30, t019	mecA (PVL+)	mecA_15_AB505628, mecA.6_BX571856, PVL_EU368820, blaZ.11_AJ400722	mecA, tet(38), blaPC1, blaR1, blaI, murA_D278E, murA_E291D, fosB, glpT_V213I
PD171964	S. aureus	t1171		mecA (PVL+)		
Stam-126	S. aureus			mecA (PVL-)		
Stam-146	S. aureus		aST30, ST30, t438	(PVL+)	PVL_HM584708	murA_D278E, murA_E291D, tet(38), glpT_V213I, fosB
Stam-121	S.saprophyticus		aSTNone	(PVL-)		fusD
VR170213	E. faecium		aST203, ST203	VanA	VanA.bc_1_Y15704, aac_6___Ii.1_L12710, tet_M_.13_AM990992, VanA_2_M97297, VanH.bc_1_Y15705, erm_B_.23_X72021, aac_6___aph_2___.1_M13771, ant_6__Ia.1_AF330699, cat_pC221_.1_X02529, ant_6__Ia.2_KF421157, msr_C_.1_AY004350	aac(6')-I, aac(6')-Ie/aph(2'')-Ia, ant(6)-Ia, msr(C), erm(B), eat(A), parC_S80R, gyrA_S83Y, tet(M), vanY-A, vanZ-A, catA, dfrF, vanX-A, vanA, vanH-A, vanS-A, vanR-A
