Prov-nummer	Art	Känd MLST eller Spa-typ (validering)	Känd MLST eller Spa-typ (resultat)	Kända resistensgener samt PVL (validering)	Kända resistensgener samt PVL (resultat)	AMRFinderPlus gener
EC3693	E. coli	ST69	aST69, ST69	OXA-244	tet_A_.4_AJ517790, mdf_A_.1_Y08743, blaOXA_244.1_KP659189, qnrB19.1_EU432277, blaOXA_244	cyaA_S352T, tet(A), qnrB19, blaOXA-244
EC3712	E. coli	ST131	aST131, ST131	OXA-48, CMY-2	blaOXA_48.1_AY236073, aac_3__IId.1_EU022314, blaCMY_3, tet_A_.4_AJ517790, qacE.1_X68232, blaTEM_1_2d, blaOXA_48, blaCMY_2, aph_3____Ib.5_AF321551, mph_A_.1_D16251, blaCMY_2.1_X91840, blaTEM_1B.1_AY458016, dfrA17.1_FJ460238, mdf_A_.1_Y08743, sul2.2_AY034138, aph_6__Id.4_CP000971, sul1.2_U12338, aadA5.1_AF137361, blaTEM_118_AY130285.1	gyrA_D87N, gyrA_S83L, blaCMY-2, mph(A), sul1, qacEdelta1, aadA5, dfrA17, aac(3)-IId, tet(A), aph(6)-Id, aph(3'')-Ib, sul2, blaTEM-1, parE_I529L, parC_E84V, parC_S80I, blaOXA-48, ptsI_V25I, uhpT_E350Q
EC3717	E. coli	ST131	aST131, ST131	NDM-1, CTX-M-27	blaNDM_1, mph_A_.1_D16251, blaCTX_M_27.1_AY156923, dfrA17.1_FJ460238, blaNDM_1.1_FN396876, mdf_A_.1_Y08743, sul2.2_AY034138, aph_6__Id.4_CP000971, ant_3____Ia.1_X02340, sul1.2_U12338, qacE.1_X68232, tet_A_.4_AJ517790, blaCTX_M_27, blaCTX_M_106, aadA5.1_AF137361, aph_3____Ib.5_AF321551	gyrA_D87N, gyrA_S83L, ptsI_V25I, dfrA17, aadA5, qacEdelta1, sul1, mph(A), sul2, aph(3'')-Ib, aph(6)-Id, tet(A), blaNDM-1, ble, blaCTX-M-27, uhpT_E350Q, parE_I529L, parC_E84V, parC_S80I
EC3718	E. coli	ST617	aST617, ST617	CMY-42, CTX-M-15	blaOXA_1, blaCTX_M_15.1_AY044436, blaCTX_M_108_JF274245.1, blaOXA_1.1_HQ170510, mdf_A_.1_Y08743, dfrA17.1_FJ460238, blaCMY_3, blaCMY_98.1_KC603538, ant_3____Ia.1_X02340, tet_B_.2_AF326777, catB3.2_U13880, qacE.1_X68232, aadA5.1_AF137361, blaCMY_42, blaCMY_42.1_HM146927, aac_6___Ib_cr.1_DQ303918_2, blaCTX_M_15	gyrA_D87N, gyrA_S83L, parE_S458A, parC_S80I, blaCMY-42, tet(B), blaCTX-M-15, aadA5, dfrA17, blaOXA-1, aac(6')-Ib-cr5
EC3721	E. coli	ST38	aST38, ST38	OXA-48, CTX-M-24	blaCTX_M_99.1_HM803271, mph_A_.1_D16251, blaOXA_48.1_AY236073, aac_3__IId.1_EU022314, blaTEM_1B.1_AY458016, dfrA17.1_FJ460238, mdf_A_.1_Y08743, ant_3____Ia.1_X02340, sul1.2_U12338, qacE.1_X68232, blaTEM_1_2d, blaOXA_48, blaCTX_M_106, blaCTX_M_24_2d, aadA5.1_AF137361, blaTEM_118_AY130285.1	blaCTX-M-24, cyaA_S352T, gyrA_S83L, dfrA17, aadA5, qacEdelta1, sul1, mph(A), aac(3)-IId, blaOXA-48, blaTEM-1
EC3738	E. coli	ST405	aST405, ST405	NDM-4, CMY-42, CTX-M-15	blaCMY_3, tet_B_.2_AF326777, rmtB.1_AB103506, blaCMY_42.1_HM146927, aac_6___Ib_cr.1_DQ303918_2, blaCTX_M_108_JF274245.1, mph_A_.1_D16251, blaOXA_1.1_HQ170510, erm_B_.1_JN899585, mdf_A_.1_Y08743, sul1.2_U12338, blaTEM_118_AY130285.1, blaCTX_M_15, blaNDM_4, blaOXA_1, blaCTX_M_15.1_AY044436, aac_3__IId.1_EU022314, dfrA14.1_KF921535, ARR_6.3_JF922883, qacE.1_X68232, blaTEM_1_2d, blaCMY_42, dfrA12.8_AM040708, blaTEM_1B.1_AY458016, aadA2.2_JQ364967, catB3.2_U13880, blaNDM_4.1_JQ348841	gyrA_D87N, gyrA_S83L, cyaA_S352T, blaCTX-M-15, parC_S80I, parE_S458A, blaCMY-42, dfrA12, aadA2, qacEdelta1, sul1, ble, blaNDM-4, tet(B), dfrA14, erm(B), erm(B), rmtB1, blaTEM-1, mph(A), aac(3)-IId, catB3, blaOXA-1, aac(6')-Ib-cr5
EC3767	E. coli	ST448	aST448	OXA-181, NDM-5, CMY-42, CTX-M-15	blaCMY_3, tet_B_.2_AF326777, blaCMY_42_b, aph_3____Ib.5_AF321551, blaCMY_42.1_HM146927, aac_6___Ib_cr.1_DQ303918_2, qnrS1.1_AB187515, blaCTX_M_108_JF274245.1, mph_A_.1_D16251, blaOXA_1.1_HQ170510, mdf_A_.1_Y08743, sul2.2_AY034138, sul1.2_U12338, blaOXA_181, blaTEM_118_AY130285.1, blaCTX_M_15, blaOXA_1, blaCTX_M_15.1_AY044436, aac_3__IId.1_EU022314, aph_6__Id.1_M28829, ARR_6.3_JF922883, qacE.1_X68232, blaTEM_1_2d, dfrA12.8_AM040708, blaNDM_5.1_JN104597, blaTEM_1B.1_AY458016, dfrA17.1_FJ460238, aadA2.2_JQ364967, catA1.1_V00622, blaOXA_181.1_CM004561, catB3.2_U13880, blaNDM_5, ere_A_.1_AY183453, aadA5.1_AF137361	blaTEM-1, aadA2, aph(6)-Id, dfrA12, qnrS1, blaOXA-181, blaCMY-42, mph(A), aac(3)-IId, sul2, catA1, gyrA_D87N, gyrA_S83L, catB3, blaOXA-1, aac(6')-Ib-cr5, blaCTX-M-15, qacEdelta1, aadA5, dfrA17, ble, tet(B)
EC3789	E. coli	ST167	aST167, ST167	NDM-5, CTX-M-15	blaOXA_1, blaCTX_M_15.1_AY044436, tet_A_.4_AJ517790, qacE.1_X68232, blaTEM_1_2d, rmtB.1_AB103506, aac_6___Ib_cr.1_DQ303918_2, dfrA12.8_AM040708, blaNDM_5.1_JN104597, blaCTX_M_108_JF274245.1, mph_A_.1_D16251, blaOXA_1.1_HQ170510, mdf_A_.1_Y08743, blaTEM_1B.1_AY458016, aadA2.2_JQ364967, sul1.2_U12338, catB3.2_U13880, blaNDM_5, blaTEM_118_AY130285.1, blaCTX_M_15	parC_S80I, parE_S458A, gyrA_D87N, gyrA_S83L, tet(A), blaNDM-5, ble, sul1, qacEdelta1, aadA2, dfrA12, rmtB1, blaTEM-1, mph(A), blaCTX-M-15, aac(6')-Ib-cr5, blaOXA-1
EC3899	E. coli	ST88	aST88, ST88	CMY-2	blaCMY_2, mdf_A_.1_Y08743, aph_3____Ib.5_AF321551, blaCMY_3, aph_6__Id.1_M28829, blaCMY_2.1_X91840	blaCMY-2, aph(3'')-Ib, aph(6)-Id
EC3913	E. coli	ST349	aST349, ST349	DHA-1	blaDHA_1.1_Y16410, qnrB4.1_DQ303921, mph_A_.1_D16251, mdf_A_.1_Y08743, dfrA17.1_FJ460238, blaDHA_1, ant_3____Ia.1_X02340, sul1.2_U12338, qacE.1_X68232, aadA5.1_AF137361	mph(A), sul1, blaDHA-1, qnrB4, dfrA17, uhpT_E350Q
K1011	K. pneumoniae	ST15	aST15, ST15	CTX-M-15	aadA10.1_U37105, blaCTX_M_15.1_AY044436, ARR_3.1_JF806499, dfrA14.1_KF921535, aadA16.1_EU675686, OqxA.1_EU370913_2, tet_A_.4_AJ517790, qacE.1_X68232, OqxB.1_EU370913_2, dfrA27.1_FJ459817, blaSHV_152, aac_6___Ib_cr.1_DQ303918_2, blaCTX_M_108_JF274245.1, mph_A_.1_D16251, blaSHV_28.1_AF299299, ant_3____Ia.1_X02340, blaTEM_1C.1_FJ560503, fosA.3_ACWO01000079, sul1.2_U12338, blaTEM_1_3d, blaSHV_28, blaTEM_118_AY130285.1, blaCTX_M_15	blaSHV-28, ramR_A19V, oqxB, oqxA, fosA, gyrA_D87A, gyrA_S83F, aac(6')-Ib-cr5, arr-3, dfrA27, aadA16, qacEdelta1, sul1, blaCTX-M-15, mph(A), tet(A), dfrA14
K923	K. pneumoniae	ST15	aST15, ST15	OXA-48, NDM-1, SHV-12	tet_A_.6_AF534183, blaOXA_48.1_AY236073, aph_3___VI.1_KC170992, blaNDM_1.1_FN396876, OqxB.1_EU370913_2, aph_3____Ib.5_AF321551, aac_6___Ib_cr.1_DQ303918_2, blaOXA_1.1_HQ170510, sul2.2_AY034138, sul1.2_U12338, floR.2_AF118107, blaOXA_1, blaNDM_1, aac_3__IId.1_EU022314, ARR_3.1_JF806499, dfrA14.1_KF921535, aph_6__Id.1_M28829, qnrB1.1_DQ351241, OqxA.1_EU370913_2, blaSHV_12, qacE.1_X68232, blaOXA_48, blaSHV_12.1_KF976405, blaSHV_165, ant_3____Ia.1_X02340, fosA.3_ACWO01000079, catB3.2_U13880	oqxB, oqxA, ramR_A19V, gyrA_D87A, gyrA_S83F, ble, blaNDM-1, aph(3')-VI, qnrB9, sul2, aph(3'')-Ib, aph(6)-Id, dfrA14, floR, aac(3)-IId, fosA, arr-3, qacEdelta1, sul1, qnrB1, blaOXA-48, tet(A), tet(A), aac(6')-Ib-cr5, blaOXA-1
K927	K. pneumoniae	ST11	aST11	OXA-245	blaOXA_1, blaSHV_11_2d, blaOXA_1.1_HQ170510, dfrA14.1_KF921535, qnrB1.1_DQ351241, OqxA.1_EU370913_2, ant_3____Ia.1_X02340, fosA.5_AFBO01000747, blaSHV_182.1_KP050489, catB3.2_U13880, OqxB.1_EU370913_2, blaOXA_245.1_JX438001, blaSHV_152, blaOXA_245, aac_6___Ib_cr.1_DQ303918_2	gyrA_D87A, gyrA_S83F, oqxB, pmrB_R256G, fosA, dfrA14, blaOXA-245, qnrB1, blaOXA-1, aac(6')-Ib-cr5, blaSHV-11
K962	K. pneumoniae	ST273	aST273, ST273	NDM-1, CTX-M-15	blaOXA_1, blaNDM_1, blaCTX_M_15.1_AY044436, blaSHV_11_15d, blaNDM_1.1_FN396876, dfrA14.1_KF921535, aph_6__Id.1_M28829, qnrB1.1_DQ351241, OqxA.1_EU370913_2, fosA.5_AFBO01000747, tet_A_.4_AJ517790, blaTEM_1_2d, OqxB.1_EU370913_2, blaSHV_152, aph_3____Ib.5_AF321551, aac_6___Ib_cr.1_DQ303918_2, blaCTX_M_108_JF274245.1, blaOXA_1.1_HQ170510, blaTEM_1B.1_AY458016, sul2.2_AY034138, blaSHV_67.1_DQ174307, ant_3____Ia.1_X02340, catB3.2_U13880, blaTEM_118_AY130285.1, blaCTX_M_15	blaNDM-1, ble, pmrB_R256G, blaSHV-11, sul2, aph(3'')-Ib, aph(6)-Id, blaTEM-1, blaCTX-M-15, dfrA14, tet(A), qnrB1, oqxB, oqxA, blaOXA-1, aac(6')-Ib-cr5, gyrA_S83I, fosA, fosA
K967-1	K. pneumoniae	ST530	aST530, ST530	OXA-48	sul2.3_HQ840942, blaOXA_48.1_AY236073, dfrA14.1_KF921535, aph_6__Id.1_M28829, blaSHV_1_16d, OqxA.1_EU370913_2, ant_3____Ia.1_X02340, blaSHV_99.1_AM941845, fosA.5_AFBO01000747, OqxB.1_EU370913_2, blaOXA_48, blaSHV_152, aph_3____Ib.5_AF321551	blaOXA-48, fosA, fosA, oqxB, blaSHV-1, sul2, aph(3'')-Ib, aph(6)-Id
K978	K. pneumoniae	ST258	aST258, ST258	KPC-2, CMY-2, CTX-M-15, SHV-12#	blaKPC_2.1_AY034847, blaCMY_3, blaOXA_9, blaSHV_123_GQ390805, fosA.5_AFBO01000747, blaKPC_9, OqxB.1_EU370913_2, blaCMY_2, blaOXA_10.1_J03427, blaCTX_M_108_JF274245.1, mph_A_.1_D16251, sul2.2_AY034138, sul1.2_U12338, aac_6___Ib.1_M21682, blaTEM_118_AY130285.1, blaCTX_M_15, floR.2_AF118107, qnrA1.1_AY070235, blaCTX_M_15.1_AY044436, OqxA.1_EU370913_2, mph_B_.1_D85892, qacE.1_X68232, blaTEM_1_2d, blaSHV_16, blaKPC_2, aph_3___Ia.7_X62115, dfrA12.8_AM040708, aadA1.5_JX185132, blaCMY_2.1_X91840, blaTEM_1B.1_AY458016, aadA2.2_JQ364967, cmlA1.1_M64556, catA1.1_V00622, blaOXA_9.1_KQ089875, blaOXA_10_2d	aac(6')-Ib, aac(6')-Ib, aac(6')-Ib, aac(6')-Ib, oqxA, oqxB, blaCMY-2, catA1, gyrA_S83I, floR, sul2, pmrB_R256G, blaKPC-2, mph(B), qacEdelta1, sul1, qnrA1, sul1, mph(A), cmlA5, blaOXA-10, aadA1, blaCTX-M-15, fosA, aadA2, dfrA12, blaTEM, blaTEM, blaTEM, blaOXA
K986	K. pneumoniae	ST437	aST437, ST437	OXA-48, CMY-16, CTX-M-15	tet_A_.6_AF534183, blaOXA_48.1_AY236073, blaCMY_3, ARR_2.1_HQ141279, fosA.5_AFBO01000747, OqxB.1_EU370913_2, blaSHV_152, aph_3____Ib.5_AF321551, blaCMY_4.1_LNHZ01000079, aac_6___Ib_cr.1_DQ303918_2, blaOXA_10.1_J03427, blaCTX_M_108_JF274245.1, blaOXA_1.1_HQ170510, sul2.2_AY034138, blaTEM_1, sul1.2_U12338, mph_E_.1_DQ839391, msr_E_.1_FR751518, blaTEM_118_AY130285.1, blaCTX_M_15, armA.1_AY220558, floR.2_AF118107, blaOXA_1, aph_3___VIa.1_X07753, blaCTX_M_15.1_AY044436, dfrA14.1_KF921535, aph_6__Id.1_M28829, qnrB1.1_DQ351241, OqxA.1_EU370913_2, qacE.1_X68232, blaOXA_48, blaTEM_1A.1_HM749966, aadA1.5_JX185132, blaCMY_16_2_FJ855437, blaSHV_11_2d, cmlA1.1_M64556, blaSHV_182.1_KP050489, catB3.2_U13880, blaOXA_10_2d	blaSHV-11, blaCMY-16, floR, tet(A), aph(6)-Id, aph(3'')-Ib, sul2, oqxA, oqxB, arr-2, cmlA5, blaOXA-10, aadA1, qacEdelta1, sul1, armA, msr(E), mph(E), aph(3')-VIa, gyrA_D87G, gyrA_S83I, qnrB1, pmrB_R256G, aac(6')-Ib-cr5, blaOXA-1, blaTEM-1, blaOXA-48, blaCTX-M-15, dfrA14, fosA, phoQ_G385S
K988	K. pneumoniae	ST307	aST307, ST307	NDM-5	OqxA.1_EU370913_2, qacE.1_X68232, OqxB.1_EU370913_2, blaTEM_1_2d, blaSHV_152, rmtB.1_AB103506, aadA2b.1_D43625, blaNDM_5.1_JN104597, blaTEM_1B.1_AY458016, dfrA17.1_FJ460238, blaSHV_28.1_AF299299, fosA.3_ACWO01000079, sul1.2_U12338, blaNDM_5, blaSHV_28, aadA5.1_AF137361, mph_E_.1_DQ839391, msr_E_.1_FR751518, blaTEM_118_AY130285.1, armA.1_AY220558	oqxB19, oqxA, blaSHV-28, mph(E), msr(E), armA, sul1, qacEdelta1, aadA5, dfrA17, rmtB1, blaTEM-1, gyrA_S83I, blaNDM-5, ble, fosA
K993	K. pneumoniae	ST147	aST147, ST147	NDM-1, CTX-M-15	blaNDM_1.1_FN396876, fosA.5_AFBO01000747, tet_A_.4_AJ517790, OqxB.1_EU370913_2, blaSHV_152, aph_3____Ib.5_AF321551, aac_6___Ib_cr.1_DQ303918_2, blaCTX_M_108_JF274245.1, blaOXA_1.1_HQ170510, blaSHV_67.1_DQ174307, dfrA1.8_X00926, sul1.2_U12338, aac_3__IIa.6_CP023555, blaTEM_118_AY130285.1, blaCTX_M_15, blaOXA_1, blaNDM_1, blaCTX_M_15.1_AY044436, blaSHV_11_15d, aph_6__Id.1_M28829, qnrB1.1_DQ351241, OqxA.1_EU370913_2, qacE.1_X68232, blaTEM_1_2d, blaTEM_1B.1_AY458016, ant_3____Ia.1_X02340, catB3.2_U13880, blaLEN15.1_AF452105	fosA, fosA, pmrB_R256G, sul1, qacEdelta1, dfrA1, tet(A), blaNDM-1, ble, aph(6)-Id, aph(3'')-Ib, qnrB1, oqxB, oqxA, blaCTX-M-15, blaTEM-1, aac(3)-IIe, aac(6')-Ib-cr5, blaOXA-1, blaSHV-11, gyrA_S83I
K999	K. pneumoniae	ST35	aST35, ST35	DHA-1	blaDHA_1.1_Y16410, qnrB4.1_DQ303921, mph_A_.1_D16251, blaDHA_1, dfrA17.1_FJ460238, blaSHV_33, OqxA.1_EU370913_2, ant_3____Ia.1_X02340, fosA.3_ACWO01000079, sul1.2_U12338, OqxB.1_EU370913_2, blaSHV_153, aadA5.1_AF137361, blaSHV_33.1_AY037779	qnrB4, blaDHA-1, sul1, mph(A), dfrA17, blaSHV-33, oqxB19, oqxA3, fosA
MRR160063	K. pneumoniae		aST14, ST14	OXA-232, NDM-1	aph_3___VI.1_KC170992, blaNDM_1.1_FN396876, OqxB.1_EU370913_2, blaSHV_152, aac_6___Ib_cr.1_DQ303918_2, blaOXA_1.1_HQ170510, dfrA1.8_X00926, sul1.2_U12338, blaOXA_232.1_JX423831, mph_E_.1_DQ839391, msr_E_.1_FR751518, armA.1_AY220558, blaOXA_1, blaNDM_1, dfrA14.1_KF921535, qnrB1.1_DQ351241, OqxA.1_EU370913_2, qacE.1_X68232, blaOXA_232, dfrA12.8_AM040708, aadA2.2_JQ364967, blaSHV_28.1_AF299299, fosA.3_ACWO01000079, catA1.1_V00622, catB3.2_U13880, ere_A_.1_AY183453, blaSHV_28	dfrA1, sat2, gyrA_D87G, gyrA_S83Y, dfrA12, aadA2, qacEdelta1, sul1, armA, msr(E), mph(E), oqxA, oqxB, ble, blaNDM-1, blaOXA-232, dfrA14, qnrB1, blaOXA-1, aac(6')-Ib-cr5, aph(3')-VI, fosA, catA1, blaSHV-28
MRR160064	K. pneumoniae		aST392, ST392	TEM-1 (non ESBL), SHV-11 (non ESBL) , CTX-M-15, OXA-48	blaOXA_1, blaCTX_M_82.1_DQ256091, blaSHV_11_15d, blaOXA_48.1_AY236073, dfrA14.1_KF921535, aph_6__Id.1_M28829, qnrB1.1_DQ351241, OqxA.1_EU370913_2, fosA.5_AFBO01000747, blaCTX_M_15_3d, tet_A_.4_AJ517790, blaTEM_1_2d, OqxB.1_EU370913_2, blaOXA_48, blaSHV_152, aph_3____Ib.5_AF321551, aac_6___Ib_cr.1_DQ303918_2, blaCTX_M_108_JF274245.1, blaOXA_1.1_HQ170510, blaTEM_1B.1_AY458016, sul2.2_AY034138, blaSHV_67.1_DQ174307, ant_3____Ia.1_X02340, catB3.2_U13880, aac_3__IIa.6_CP023555, blaTEM_118_AY130285.1	fosA, fosA, pmrB_R256G, blaSHV-11, sul2, aph(3'')-Ib, aph(6)-Id, blaTEM-1, blaCTX-M-15, dfrA14, tet(A), gyrA_S83I, qnrB1, aac(3)-IIe, aac(6')-Ib-cr5, blaOXA-1, blaOXA-48, oqxB, oqxA
MRR160065	K. pneumoniae		aST29, ST29	TEM-1 (non ESBL), SHV-5, VIM-1	tet_A_.6_AF534183, aac_6___Il.1_U13880, blaSHV_126_GQ390808, dfrA1.9_AJ238350, ARR_2.1_HQ141279, rmtB.1_AB103506, aph_3____Ib.5_AF321551, blaOXA_10.1_J03427, blaSHV_16.1_AF072684, aac_3__I.1_AJ877225, sul2.2_AY034138, ant_2____Ia.1_X04555, sul1.2_U12338, blaTEM_118_AY130285.1, floR.2_AF118107, aph_6__Id.1_M28829, qacE.1_X68232, blaTEM_1_2d, blaSHV_16, aph_3___Ia.7_X62115, blaVIM_1.1_Y18050, aadA1.5_JX185132, aac_6___Ib3.1_X60321, blaTEM_1B.1_AY458016, blaVEB_1.3_DQ393569, tet_G_.2_AF133140, cmlA1.1_M64556, blaVEB_1_2d, fosA.3_ACWO01000079, blaVIM_1, blaOXA_10_2d	sul2, aph(3'')-Ib, aph(6)-Id, tet(A), gyrA_S83Y, blaTEM-1, rmtB1, tet(G), floR2, blaOXA-10, cmlA5, arr-2, ant(2'')-Ia, blaVEB-1, fosA, aac(6')-Ib3, aac(3)-Ia, blaVIM-1, aac(6')-Il, dfrA1, aph(3')-Ia, qacEdelta1
MRR160066	K. pneumoniae		aST258, ST258	SHV-11 (non ESBL), SHV-12, KPC-2, TEM-1 (non ESBL)	blaKPC_2.1_AY034847, blaOXA_9, OqxA.1_EU370913_2, fosA.5_AFBO01000747, blaSHV_123_GQ390805, blaKPC_9, qacE.1_X68232, OqxB.1_EU370913_2, blaSHV_16, blaKPC_2, aph_3___Ia.1_V00359, dfrA12.8_AM040708, blaTEM_1A.1_HM749966, mph_A_.1_D16251, aadA2.2_JQ364967, blaTEM_1, catA1.1_V00622, blaOXA_9.1_KQ089875, sul1.2_U12338, aac_6___Ib.1_M21682, blaTEM_118_AY130285.1	oqxR_Q11L, oqxB, oqxA, mph(A), sul1, qacEdelta1, aadA2, dfrA12, catA1, blaKPC-2, pmrB_R256G, blaOXA, aph(3')-Ia, aac(6')-Ib', fosA, blaTEM, blaTEM, blaTEM, gyrA_S83I
MRR160067	E. coli		aST404, ST404	Negativ för ESBL	mdf_A_.1_Y08743	blaEC-5, uhpT_E350Q, marR_S3N
MRR160068	P. aeroginosa		aST621, ST621	IMP-13	blaOXA_50.1_AY306130, aph_3___VIa.1_X07753, aac_6___Ib3.1_X60321, blaPAO.4_AY083592, blaIMP_13.1_AJ550807, ant_3____Ia.1_X02340, blaIMP_68.1_MF669572, catB7.1_AF036933, crpP.1_HM560971, qacE.1_X68232, fosA.4_ACWU01000146, sul1.2_U12338, blaIMP_13_NG_049176, aph_3___IIb.2_CP006832	blaOXA-914, aph(3')-IIb, blaPDC-5, catB7, sul1, qacEdelta1, aac(6')-Ib4, blaIMP-13, crpP, aph(3')-VIa, fosA
MRR160069	E. cloacae		aST141, ST141	SHV-12, CTX-M-9, OXA-48	qnrA1.1_AY070235, blaOXA_48.1_AY236073, dfrA16.2_AF174129, tet_A_.4_AJ517790, qacE.1_X68232, blaSHV_12, blaOXA_48, mcr_9.1_NZ_NAAN01000063.1, blaSHV_12.1_KF976405, blaCTX_M_9_2d, blaSHV_165, aadA2b.1_D43625, aac_6___Ib3.1_X60321, blaACT_7, blaACT_7.1_FJ237368, ant_2____Ia.1_X04555, catA1.1_V00622, sul1.2_U12338, blaCTX_M_106, blaLEN15.1_AF452105, blaCTX_M_9.1_AF174129	blaACT-44, oqxB, oqxA, blaSHV-12, tet(A), aac(6')-Ib3, blaCTX-M-9, blaOXA-48, qnrA1, ant(2'')-Ia, catA1, dfrA16
MRR160070	P. vulgaris		aSTNone	TEM-24	aac_6___Ib3.1_X60321, sul2.2_AY034138, blaTEM_24.1_GQ293500, ant_3____Ia.1_X02340, sul1.2_U12338, qacE.1_X68232, tet_H_.2_AJ245947, blaTEM_22, blaTEM_24, floR.2_AF118107	sul2, floR, sul1, qacEdelta1, aac(6')-Ib3, blaTEM-24
MR160644B	E. coli		aST5954, ST5954	Negativ för ESBL (TEM wt)	mph_A_.1_D16251, aac_3__IId.1_EU022314, blaTEM_1B.1_AY458016, dfrA17.1_FJ460238, mdf_A_.1_Y08743, ant_3____Ia.1_X02340, sul1.2_U12338, qacE.1_X68232, blaTEM_1_2d, aadA5.1_AF137361, blaTEM_118_AY130285.1	cyaA_S352T, gyrA_D87N, gyrA_S83L, blaTEM-1, parE_S458A, parC_S80I, mph(A), dfrA17, aadA5, qacEdelta1, sul1, aac(3)-IId
MRR160054	E. coli		aST46*, ST46	CTX-M GR 1, OXA-48	qnrS1.1_AB187515, blaCTX_M_15.1_AY044436, mph_A_.1_D16251, blaOXA_48.1_AY236073, erm_B_.1_JN899585, dfrA17.1_FJ460238, mdf_A_.1_Y08743, blaCTX_M_108_JF274245.1, sul2.2_AY034138, aph_6__Id.4_CP000971, ant_3____Ia.1_X02340, sul1.2_U12338, qacE.1_X68232, tet_A_.4_AJ517790, blaOXA_48, aadA5.1_AF137361, aph_3____Ib.5_AF321551, blaCTX_M_15	tet(A), blaOXA-48, qnrS1, blaCTX-M-15, mph(A), sul1, qacEdelta1, aadA5, dfrA17, erm(B), erm(B), aph(6)-Id, aph(3'')-Ib, sul2
MRR160072	E. coli		aST405, ST405	NDM, CMY2 (TEM wt)	dfrA12.8_AM040708, blaNDM_5.1_JN104597, mph_A_.1_D16251, mdf_A_.1_Y08743, blaTEM_1B.1_AY458016, aadA2.2_JQ364967, blaCMY_3, tet_B_.2_AF326777, sul1.2_U12338, qacE.1_X68232, blaTEM_1_2d, blaNDM_5, qepA4.1_KX580704, blaCMY_42.1_HM146927, blaTEM_118_AY130285.1, blaCMY_42_CP023957	parE_S458A, parC_S80I, gyrA_D87N, gyrA_S83L, cyaA_S352T, blaCMY, tet(B), blaNDM-5, ble, sul1, qacEdelta1, aadA2, dfrA12, qepA4, mph(A), blaTEM-1
UO1639842	E. coli		aST778, ST778	CMY2	catA1.1_V00622, blaCMY_2, mdf_A_.1_Y08743, blaCMY_3, blaCMY_2.1_X91840, tet_B_.2_AF326777	uhpT_E350Q, gyrA_S83A, cyaA_S352T, blaCMY-2, tet(B), catA1
AB164094	K. pneumoniae		aST258*, ST258	SHV, KPC (TEM wt)	blaKPC_2.1_AY034847, aac_3__IV.1_DQ241380, blaOXA_9, fosA.5_AFBO01000747, blaKPC_9, OqxB.1_EU370913_2, aadA2b.1_D43625, aph_3___Ia.1_V00359, sul3.2_AJ459418, mph_A_.1_D16251, blaTEM_1, sul1.2_U12338, blaSHV_153, aac_6___Ib.1_M21682, blaTEM_118_AY130285.1, OqxA.1_EU370913_2, aph_4__Ia.1_V01499, qacE.1_X68232, aadA1.3_JQ414041, blaKPC_2, blaSHV_11_7d, blaTEM_1A.1_HM749966, mef_B_.1_FJ196385, cmlA1.1_M64556, blaSHV_182.1_KP050489, blaOXA_9.1_KQ089875, aadA13.1_AY713504	gyrA_S83I, blaKPC-2, blaSHV-11, aac(6')-Ib, sul3, qacL, aadA1, cmlA1, aac(3)-IVa, aph(4)-Ia, oqxB, oqxA, mph(A), sul1, qacEdelta1, pmrB_R256G, blaOXA, aph(3')-Ia, blaTEM, blaTEM, blaTEM, aadA2, fosA
MRR160058	K. pneumoniae		aST17, ST17	CTX-M GR 1, DHA (SHV wt, TEM wt)	blaDHA_1.1_Y16410, blaCTX_M_82.1_DQ256091, tet_A_.4_AJ517790, OqxB.1_EU370913_2, aph_3____Ib.5_AF321551, aph_3___Ia.1_V00359, blaCTX_M_108_JF274245.1, mph_A_.1_D16251, sul2.2_AY034138, aph_6__Id.4_CP000971, sul1.2_U12338, blaSHV_11, blaSHV_153, aac_3__IIa.6_CP023555, aac_6___Ib.1_M21682, blaTEM_118_AY130285.1, qnrB4.1_DQ303921, dfrA14.1_KF921535, blaSHV_96.1_EF373971, OqxA.1_EU370913_2, qacE.1_X68232, blaTEM_1_2d, blaDHA_1_JX495964, blaTEM_1B.1_AY458016, ant_3____Ia.1_X02340, fosA.3_ACWO01000079, blaCTX_M_55	blaSHV-11, qnrB4, blaDHA-1, sul1, sul2, aph(3'')-Ib, aph(6)-Id, blaTEM-1, tet(A), mph(A), dfrA14, aac(3)-IIe, aac(6')-Ib, oqxA, oqxB25, aph(3')-Ia, fosA
PK161096A	K. pneumoniae		aSTNovel	Negativ för ESBL (SHV wt)	OqxA.1_EU370913_2, OqxB.1_EU370913_2, blaSHV_152, blaSHV_1_16d, blaSHV_99.1_AM941845, fosA.3_ACWO01000079	blaSHV-1, oqxB5, oqxA, fosA
MRR160074	P. mirabilis		aSTNone	CTX-M GR 1 (TEM wt)	aadA2b.1_D43625, blaCTX_M_15.1_AY044436, blaCTX_M_108_JF274245.1, aadA5.1_AF137361, blaTEM_1B.1_AY458016, cat.1_M11587, tet_J_.1_ACLE01000065, cmlA1.1_M64556, ant_2____Ia.1_X04555, catA1.1_V00622, dfrA1.8_X00926, qacE.1_X68232, sul1.2_U12338, blaTEM_1_2d, aph_6__Id.3_AB109805, aph_3____Ib.5_AF321551, blaTEM_118_AY130285.1, blaCTX_M_15	blaTEM-1, blaCTX-M-15, ant(2'')-Ia, cmlA5, aadA2, aph(3'')-Ib, aph(6)-Id, catA1, dfrA1, catA, aadA5, qacEdelta1, tet(J)
PD164637B	P. mirabilis		aSTNone	PER (TEM wt)	blaPER_5, sul2.3_HQ840942, blaPER_1_KP054476, cat.1_M11587, tet_J_.1_ACLE01000065, aph_6__Id.1_M28829, qacE.1_X68232, blaTEM_1_2d, dfrA7.1_AB161450, aph_3____Ib.5_AF321551, blaPER_1.1_GU944725, aadA2b.1_D43625, aph_3___Ia.1_V00359, blaTEM_1B.1_AY458016, ant_3____Ia.1_X02340, ant_2____Ia.1_X04555, catA1.1_V00622, sul1.2_U12338, blaTEM_118_AY130285.1	catA1, blaPER-1, aph(6)-Id, aph(3'')-Ib, sul2, ant(3'')-Ia, qacE, qacE, blaTEM-1, aph(3')-Ia, sul1, sul1, sul1, dfrA7, ant(2'')-Ia, tet(J), catA
PY153330	P. aeroginosa		aST235, ST235	IMP	aph_3___Ia.1_V00359, blaPAO.4_AY083592, blaIMP_1_AB472901_2, aadA6.1_AF140629, ant_3____Ia.1_X02340, ant_2____Ia.1_X04555, blaOXA_488.1_CP017969, catB7.1_AF036933, crpP.1_HM560971, dfrA1.8_X00926, fosA.4_ACWU01000146, qacE.1_X68232, sul1.2_U12338, blaIMP_1.1_EF027105, aph_3___IIb.2_CP006832	fosA, blaOXA-488, aph(3')-IIb, blaPDC-35, catB7, blaIMP-1, aac(6')-Ib4, aac(6')-Ib4, ant(2'')-Ia, dfrA1, qacE, sul1, aadA6, crpP
PY1604185	E. cloacae		aSTNovel	NDM	fosA.7_AEXB01000013, blaNDM_1, sul1.8_JN581942, blaTEM_1B.1_AY458016, blaNDM_1.1_FN396876, rmtC.1_AB194779, aph_6__Id.1_M28829, blaACT_7.1_FJ237368, sul2.2_AY034138, blaACT_7, blaTEM_1_2d, OqxB.1_EU370913_2, aph_3____Ib.5_AF321551, blaTEM_118_AY130285.1	blaACT-75, oqxA, oqxB, fosA, ble, blaNDM-1, rmtC, sul1, sul1, sul2, aph(6)-Id, aph(3'')-Ib, blaTEM
MR130386-1	A. baumanni	ST2	aST195, ST2		tet_B_.1_AP000342, blaOXA_23, blaADC_25.1_EF016355, aph_6__Id.1_M28829, blaOXA_66.1_AY750909, sul2.2_AY034138, blaTEM_1D.1_AF188200, blaTEM_1_4d, blaOXA_23.1_AY795964, aph_3____Ib.5_AF321551, blaOXA_66, aph_3___Ia.7_X62115, blaTEM_118_AY130285.1	ant(3'')-IIa, blaADC-73, tet(B), aph(6)-Id, aph(3'')-Ib, parC_S84L, ftsI_A515V, blaOXA-66, blaOXA-23, blaTEM-1, aph(3')-Ia, sul2, gyrA_S81L
MR130386-2	A. baumanni	ST2	aST1114, ST2		tet_B_.1_AP000342, aph_3___VIa.1_X07753, blaOXA_23, aadA1.5_JX185132, blaADC_25.1_EF016355, aph_6__Id.1_M28829, blaOXA_66.1_AY750909, sul2.2_AY034138, blaTEM_1D.1_AF188200, qacE.1_X68232, blaOXA_23.1_AY795964, sul1.2_U12338, blaTEM_1_4d, aac_3__Ia.1_X15852, aph_3____Ib.5_AF321551, blaOXA_66, blaTEM_118_AY130285.1	ant(3'')-IIa, tet(B), aph(6)-Id, aph(3'')-Ib, blaADC-30, parC_S84L, blaOXA-66, gyrA_S81L, sul1, qacEdelta1, aadA1, aac(3)-Ia, blaOXA-23, blaTEM-1, sul2, aph(3')-VIa
NL160346	A. baumanni	ST10	aST391, ST10		tet_B_.1_AP000342, aph_3___VIa.1_X07753, blaOXA_23, blaADC_25.1_EF016355, aph_6__Id.1_M28829, ARR_2.1_HQ141279, cmlA1.1_M64556, ant_3____Ia.1_X02340, sul2.2_AY034138, sul1.2_U12338, qacE.1_X68232, blaOXA_23.1_AY795964, blaOXA_68.1_AY750910, aph_3____Ib.5_AF321551, blaOXA_66, mph_E_.1_DQ839391, msr_E_.1_FR751518, armA.1_AY220558	blaADC-76, blaOXA-68, parC_S84L, gyrA_S81L, arr-2, cmlA5, qacEdelta1, sul1, armA, msr(E), mph(E), blaOXA-23, tet(B), aph(6)-Id, aph(3'')-Ib, aph(3')-VIa, sul2, ant(3'')-IIa, ant(3'')-IIa
PY1604385	A. baumanni	ST10	aST391, ST10	OXA-23	tet_B_.1_AP000342, aph_3___VIa.1_X07753, blaOXA_23, blaADC_25.1_EF016355, aph_6__Id.1_M28829, ARR_2.1_HQ141279, cmlA1.1_M64556, ant_3____Ia.1_X02340, sul2.2_AY034138, sul1.2_U12338, qacE.1_X68232, blaOXA_23.1_AY795964, blaOXA_68.1_AY750910, aph_3____Ib.5_AF321551, blaOXA_66, mph_E_.1_DQ839391, msr_E_.1_FR751518, armA.1_AY220558	aph(6)-Id, aph(3'')-Ib, aph(3')-VIa, sul2, blaADC-76, gyrA_S81L, blaOXA-68, parC_S84L, mph(E), msr(E), armA, sul1, qacEdelta1, cmlA5, arr-2, blaOXA-23, ant(3'')-IIa, ant(3'')-IIa, tet(B)
CDO160115	C. difficile		aST33, ST33			blaCDD
CDO160117	C. difficile		aST55, ST55			blaCDD
CDO160118	C. difficile		aST49, ST49			blaCDD
CDO160123	C. difficile		aST49, ST49			blaCDD
CDO160127	C. difficile		aST49, ST49			blaCDD
HY175294	S. aureus		aST247, ST247, t051		erm_A_.1_X03216, ant_9__Ia.1_X02588, mecA_4_AB033763, mecA.2_NC_002951, aac_6___aph_2___.1_M13771, tet_M_.7_FN433596	rpoB_H481N, tet(38), gyrA_S84L, erm(A), ant(9)-Ia, mecA, parC_S80F, aac(6')-Ie/aph(2'')-Ia, fosB
HY175295	S. aureus		aST45, ST45, t004		cfr_C_.1_KX686749, aph_3___III.1_M26832, mecA_15_AB505628, ant_6__Ia.1_AF330699, mecA.6_BX571856, blaZ.7_AP004832, ant_6__Ia.2_KF421157	parC_S80F, gyrA_S84L, mecA, tet(38), murA_E291D, murA_T396N, blaI, blaR1, blaZ, ant(6)-Ia, sat4, aph(3')-IIIa
HY175296	S. aureus		aST1, ST1, t127		mecA.6_BX571856, mecA_15_AB505628, aadD.2_M19465, blaZ.7_AP004832	aadD1, bleO, mecA, tet(38), blaI, blaR1, blaZ
HY175297	S. aureus		aST45, ST45, t004		cfr_C_.1_KX686749, aph_3___III.1_M26832, mecA_15_AB505628, ant_6__Ia.1_AF330699, mecA.6_BX571856, blaZ.7_AP004832, ant_6__Ia.2_KF421157	ant(6)-Ia, sat4, aph(3')-IIIa, parC_S80F, gyrA_S84L, mecA, tet(38), murA_E291D, murA_T396N, blaI, blaR1, blaZ
HY175298	S. aureus		aST254, ST254, t009		erm_A_.1_X03216, ant_9__Ia.1_X02588, mecA_4_AB033763, cat_pC194_.1_NC_002013, mecA.2_NC_002951, aac_6___aph_2___.1_M13771, tet_M_.1_X92947	catA, catA, dfrB_F99Y, dfrB_H31N, parC_S80F, mecA, aac(6')-Ie/aph(2'')-Ia, fosB, tet(M), gyrA_S84L, tet(38), ant(9)-Ia, erm(A)
HY175299	S. aureus		aST5*, ST5, t002		erm_A_.1_X03216, mecA_15_AB505628, ant_9__Ia.1_X02588, mecA.6_BX571856, aadD.2_M19465	ant(9)-Ia, erm(A), mecI, mecR1, mecA, aadD1, bleO, gyrA_S84L, fosB, tet(38), parC_S80F
HY175300	S. aureus		aST45, ST45, t004		cfr_C_.1_KX686749, aph_3___III.1_M26832, mecA_15_AB505628, ant_6__Ia.1_AF330699, mecA.6_BX571856, blaZ.7_AP004832, ant_6__Ia.2_KF421157	ant(6)-Ia, sat4, aph(3')-IIIa, parC_S80F, gyrA_S84L, mecA, tet(38), murA_E291D, murA_T396N, blaI, blaR1, blaZ
HY175301	S. aureus		aST228, ST228, t001		erm_A_.1_X03216, ant_9__Ia.1_X02588, blaZ.11_AJ400722, mecA_15_AB505628, qacA.1_AB566410, aac_6___aph_2___.1_M13771, mecA.6_BX571856	gyrA_S84L, qacA, blaI, blaR1, blaR1, blaZ, mecA, tet(38), parC_S80F, fosB, ant(9)-Ia, erm(A), aac(6')-Ie/aph(2'')-Ia
HY175302	S. aureus		aST5*, ST5, t002		erm_A_.1_X03216, mecA_15_AB505628, ant_9__Ia.1_X02588, mecA.6_BX571856, aadD.2_M19465	erm(A), ant(9)-Ia, fosB, gyrA_S84L, bleO, aadD1, mecA, mecR1, mecI, tet(38), parC_S80F
SASPA17S-01	S. aureus	t008	aST8, ST8, t008		mecA.6_BX571856, mecA_15_AB505628, aadD.2_M19465, blaZ.29_JDXN01000019	blaI, blaR1, blaR1, blaZ, mecA, bleO, aadD1, gyrA_S84L, fosB, tet(38), murA_G257D, parC_E84V, parC_S80Y
